### ISSUE TITLE
The first generated image gets lost

### ISSUE THREAD

**Issue by fukc-gihtub** [Acly/krita-ai-diffusion#2109]
With a custom ComfyUI server, the first image generated after the server starts often ~~(always?)~~ gets lost. In the server console I can see it gets successfully generated (100%, Prompt executed in ...), but it never appears in Krita. The generation then continues and the remaining images/batches do appear in Krita.

**Comment by fukc-gihtub** [comment]
I think this is it. The plugin sometimes receives a `ClientEvent.disconnected` event for some reason. The server meanwhile continues to run the job and shows 100% done.

    ClientMessage(event=<ClientEvent.connected: 4>, job_id='', progress=0, images=None, result=None, error=None)
    ClientMessage(event=<ClientEvent.progress: 0>, job_id='4739b4a0-e4ab-4e07-b248-f9ed45d593e0', progress=0.11764705882352942, images=None, result=None, error=None)

    
    (skipped)
    

    ClientMessage(event=<ClientEvent.progress: 0>, job_id='4739b4a0-e4ab-4e07-b248-f9ed45d593e0', progress=0.5811764705882354, images=None, result=None, error=None)
    **ClientMessage(event=<ClientEvent.disconnected: 5>, job_id='', progress=0, images=None, result=None, error=None)**
    ClientMessage(event=<ClientEvent.connected: 4>, job_id='', progress=0, images=None, result=None, error=None)
    ClientMessage(event=<ClientEvent.connected: 4>, job_id='', progress=0, images=None, result=None, error=None)
    ClientMessage(event=<ClientEvent.connected: 4>, job_id='', progress=0, images=None, result=None, error=None)

    
    the next job starts here:
    

    ClientMessage(event=<ClientEvent.progress: 0>, job_id='90548eb9-4957-49fd-9d12-f21bb074ef49', progress=0.11764705882352942, images=None, result=None, error=None)
    ClientMessage(event=<ClientEvent.progress: 0>, job_id='90548eb9-4957-49fd-9d12-f21bb074ef49', progress=0.12941176470588237, images=None, result=None, error=None)

In the server console (5 images done but only 4 show up in Krita):

    loaded completely 13524.688992370606 11350.067443847656 True
    100%|███████████████████████████████████████████████████████████████████████████████████████████████| 20/20 [00:40<00:00,  2.01s/it]
    Requested to load AutoencodingEngine
    loaded completely 181.96966552734375 159.87335777282715 True
    Prompt executed in 74.72 seconds
    loaded completely 13552.690642227173 11350.067443847656 True
    100%|███████████████████████████████████████████████████████████████████████████████████████████████| 20/20 [00:39<00:00,  1.97s/it]
    Prompt executed in 41.27 seconds
    loaded completely 13552.690642227173 11350.067443847656 True
    100%|███████████████████████████████████████████████████████████████████████████████████████████████| 20/20 [00:39<00:00,  1.97s/it]
    Prompt executed in 41.11 seconds
    loaded completely 13543.315642227173 11350.067443847656 True
    100%|███████████████████████████████████████████████████████████████████████████████████████████████| 20/20 [00:39<00:00,  1.96s/it]
    Prompt executed in 40.85 seconds
    loaded completely 13543.315642227173 11350.067443847656 True
    100%|███████████████████████████████████████████████████████████████████████████████████████████████| 20/20 [00:39<00:00,  1.96s/it]
    Prompt executed in 40.92 seconds

**Comment by Acly** [comment]
`ClientEvent.disconnected` only happens when the web-socket connection is interrupted, ie. an actual disconnect. It establishes a new connection afterwards, that can lead to images being dropped.

Not really sure what would cause it though, I have not heard of this happening to anyone else.

**Comment by fukc-gihtub** [comment]
Thanks. I'll try to use tcpdump and see what happens to the connection.

**Comment by fukc-gihtub** [comment]
Looks like the ComfyUI server briefly stopped listening on port 8188, then after ~18 seconds reappeared.

```
18:11:37.018154 IP localhost.35384 > localhost.8188: Flags [S], seq 3795044722, win 65495, options [mss 65495,sackOK,TS val 109756410 ecr 0,nop,wscale 7], length 0
18:11:37.018166 IP localhost.8188 > localhost.35384: Flags [R.], seq 0, ack 3795044723, win 0, length 0
18:11:38.266419 IP localhost.35396 > localhost.8188: Flags [S], seq 2031376696, win 65495, options [mss 65495,sackOK,TS val 109757658 ecr 0,nop,wscale 7], length 0
18:11:38.266441 IP localhost.8188 > localhost.35396: Flags [R.], seq 0, ack 2031376697, win 0, length 0
18:11:41.446330 IP localhost.35404 > localhost.8188: Flags [S], seq 3141138761, win 65495, options [mss 65495,sackOK,TS val 109760838 ecr 0,nop,wscale 7], length 0
18:11:41.446340 IP localhost.8188 > localhost.35404: Flags [R.], seq 0, ack 3141138762, win 0, length 0
18:11:47.733769 IP localhost.42540 > localhost.8188: Flags [S], seq 202298530, win 65495, options [mss 65495,sackOK,TS val 109767126 ecr 0,nop,wscale 7], length 0
18:11:47.733779 IP localhost.8188 > localhost.42540: Flags [R.], seq 0, ack 202298531, win 0, length 0
18:11:55.699660 IP localhost.40098 > localhost.8188: Flags [S], seq 4263675808, win 65495, options [mss 65495,sackOK,TS val 109775091 ecr 0,nop,wscale 7], length 0
18:11:55.699687 IP localhost.8188 > localhost.40098: Flags [S.], seq 595867381, ack 4263675809, win 65483, options [mss 65495,sackOK,TS val 109775092 ecr 109775091,nop,wscale 7], length 0
```
